{
  "basisline_version": "0.1",
  "record_type": "outcome",
  "outcome_id": "bo_2026-09-20_b12c",
  "receipt_id": "bl_2026-08-20_a91f",
  "recorded_on": "2026-09-20",
  "actual_result": "Recognised revenue was ₹11.4 lakh",
  "learning": "Platform attribution materially overstated CRM-confirmed commercial outcomes"
}
